{
  "schemaVersion": "1.0.0",
  "id": "open-school-layout",
  "label": "Open School Layout",
  "steps": [
    { "id": "snapshot-system", "label": "Snapshot system status", "tool": "system.status.read" },
    { "id": "recent-notes", "label": "Surface recent notes", "tool": "note.search", "input": { "query": "today" } },
    { "id": "open-courses", "label": "Open courses", "tool": "app.open", "input": { "appId": "canvas" } }
  ]
}
